{
  "version": "5.0.0",
  "categoryReasons": {
    "regex-literal": "Exact Cyrillic regex syntax is required for byte-stable Russian matching tests.",
    "key-literal": "Exact Russian activation keyword or morphology example is required for matching behavior.",
    "test-string": "Deliberate Russian positive, negative, or adversarial input is required for multilingual coverage.",
    "source-path": "An exact historical source path is allowed only in the non-runtime migration record.",
    "ui-literal": "The exact localized UI label is preserved because literal translation can invert its documented logic."
  },
  "categoryPaths": {
    "regex-literal": [
      "^references/keys-and-regex\\.md$",
      "^scripts/(?:services/style|token_model_map)\\.mjs$",
      "^tests/(?:fixtures/regex|key-fixtures|unit)/.+\\.(?:json|mjs)$"
    ],
    "key-literal": [
      "^assets/lorebook_template\\.json$",
      "^references/(?:keys-and-regex|lorebooks)\\.md$",
      "^tests/(?:fixtures/lorebooks|key-fixtures|unit)/.+\\.(?:json|mjs)$"
    ],
    "test-string": [
      "^evals/.+\\.json$",
      "^references/keys-and-regex\\.md$",
      "^scripts/services/repo-check\\.mjs$",
      "^tests/.+\\.(?:json|mjs|txt)$"
    ],
    "source-path": [
      "^references/migration-notes\\.md$"
    ],
    "ui-literal": [
      "^references/lorebooks\\.md$",
      "^scripts/lib/st-matching\\.mjs$",
      "^tests/(?:fixtures/regex|unit)/.+\\.(?:json|mjs)$"
    ]
  },
  "exceptions": [
    {
      "path": "assets/lorebook_template.json",
      "line": 35,
      "sha256": "85c3c686e8997557d80169e95525d9144b25c1b13751c6f3f64aa112118e062a",
      "category": "key-literal"
    },
    {
      "path": "evals/behavior.json",
      "line": 6,
      "sha256": "5002f41def1ceb8fd3eaf734c4be11c79479d9420cfff116d14acd8587782c8f",
      "category": "test-string"
    },
    {
      "path": "evals/behavior.json",
      "line": 20,
      "sha256": "f4888342cc3a45a51a5f155b7cd8e30f612f5a4c8e9d217c088770a074cda479",
      "category": "test-string"
    },
    {
      "path": "evals/behavior.json",
      "line": 34,
      "sha256": "99be313016d0d33ffd1e6f9779c7e26ba4d149ac0049dda49d4bdaadbe2c8b6a",
      "category": "test-string"
    },
    {
      "path": "evals/behavior.json",
      "line": 48,
      "sha256": "2eb9bc358f649d95d7b5e7797fd00ae5ff1f985ddb3f5a508e3bbf21a3520914",
      "category": "test-string"
    },
    {
      "path": "evals/behavior.json",
      "line": 62,
      "sha256": "cf36f39cf2349ef12688387eb991aecf9e84e4cf01c2b1b99617fd792912e5d8",
      "category": "test-string"
    },
    {
      "path": "evals/behavior.json",
      "line": 76,
      "sha256": "f62a803895f272703f3a81fba6ef537f1a081b18cdf251dc1aafcdc3c94116bf",
      "category": "test-string"
    },
    {
      "path": "evals/behavior.json",
      "line": 91,
      "sha256": "6daa93b45ffbb4c4d9b16b9d181d8f6f6f714587f143b642f975c1590a1a65c4",
      "category": "test-string"
    },
    {
      "path": "evals/behavior.json",
      "line": 105,
      "sha256": "d51c2f4f3b03a5e2bc7ed0b0b4347eaeaab06d0863003ce2ee8aa67838c6eabb",
      "category": "test-string"
    },
    {
      "path": "evals/behavior.json",
      "line": 120,
      "sha256": "8823ff5fbc7f3ccc098e5ca04fdb1dff85dbeeff06d0a88d9b23f99f430e4f86",
      "category": "test-string"
    },
    {
      "path": "evals/behavior.json",
      "line": 134,
      "sha256": "2d112f837e939f611dd5adc512aff99f57d1536e0a3aded7a490282ab36de978",
      "category": "test-string"
    },
    {
      "path": "evals/behavior.json",
      "line": 148,
      "sha256": "54d16a99d0e4eb047b741e989c619ccf087f675698679bc7442fa323f80fdc7c",
      "category": "test-string"
    },
    {
      "path": "evals/behavior.json",
      "line": 162,
      "sha256": "bc0778518d4bd9d100fa88cc6358c8c88a40f83b047c06c703339e70688b5a8d",
      "category": "test-string"
    },
    {
      "path": "evals/behavior.json",
      "line": 176,
      "sha256": "8256c91bec7a3224a4faf1a385cb7739790d63ad120cca374b2f82a755a6ed60",
      "category": "test-string"
    },
    {
      "path": "evals/behavior.json",
      "line": 190,
      "sha256": "402e8756a4593e31bdfe8036de5dc47c4c44c9a2dc4a4f3894ad5ed3b6388c93",
      "category": "test-string"
    },
    {
      "path": "evals/behavior.json",
      "line": 205,
      "sha256": "1cbae8bb086ff6fcdaaede5b1e8484bd8f24540214b0cd312cd67ab13c33ab13",
      "category": "test-string"
    },
    {
      "path": "evals/behavior.json",
      "line": 219,
      "sha256": "54f4bfbc9b175a7b7b0627088d3e7c6d1be0e5a3cce98a98d21f6fbb14b63573",
      "category": "test-string"
    },
    {
      "path": "evals/behavior.json",
      "line": 234,
      "sha256": "bd091bf24ef8136840f7c052e2067e17abaca00f8f6676d615862e321fec5ba7",
      "category": "test-string"
    },
    {
      "path": "evals/behavior.json",
      "line": 248,
      "sha256": "09a73b315b0c86135d8f3cdadb72aef72cc455be24f7bd0dc0b4596663346d2c",
      "category": "test-string"
    },
    {
      "path": "evals/behavior.json",
      "line": 262,
      "sha256": "827824dbb60eeb316843dc2773e37bd60f58b63f409eea42f285c091f8768f7a",
      "category": "test-string"
    },
    {
      "path": "evals/behavior.json",
      "line": 276,
      "sha256": "49777611c841615b71c4a248606c0f1202e7fbb22d991b264f476770bc47c0b8",
      "category": "test-string"
    },
    {
      "path": "evals/triggers.train.json",
      "line": 7,
      "sha256": "9e7a0b16cdf0800f6c98a88e8be129571ed83947396dd44ef02de78eb47305b1",
      "category": "test-string"
    },
    {
      "path": "evals/triggers.train.json",
      "line": 14,
      "sha256": "a42e5f756a87badf8c5bc7f0b908dd188026f1ae2889a2aee17078306a7978b9",
      "category": "test-string"
    },
    {
      "path": "evals/triggers.train.json",
      "line": 21,
      "sha256": "cd43b723b79a7e4d94b81fb98deeb81aea47790684c0165081862094dc01fd37",
      "category": "test-string"
    },
    {
      "path": "evals/triggers.train.json",
      "line": 28,
      "sha256": "427e6df045c2150105152a2e267e745885568087b6e8df388d515ae12caff95b",
      "category": "test-string"
    },
    {
      "path": "evals/triggers.train.json",
      "line": 35,
      "sha256": "3f703c87c4dbc9c07ac8186a584d4936cb630dfbfb903cd455689ce6a541683b",
      "category": "test-string"
    },
    {
      "path": "evals/triggers.train.json",
      "line": 42,
      "sha256": "1e22862fd9d391b04662f5bcab7612e674b7956fc7c37399f8a5893bdb45b4ce",
      "category": "test-string"
    },
    {
      "path": "evals/triggers.train.json",
      "line": 49,
      "sha256": "e733629f8fe82d2c2cfc3c0aed7f7bca423e1ae0988064dc2231d73a5968875c",
      "category": "test-string"
    },
    {
      "path": "evals/triggers.train.json",
      "line": 56,
      "sha256": "7dcaa55578b645c00c51446f69526b204d102aa914e9d887d21c109a8fdd013d",
      "category": "test-string"
    },
    {
      "path": "evals/triggers.train.json",
      "line": 63,
      "sha256": "53cc07017c5e5ff3b13e5b6adc850c75a3c280d0e09f61652248c0656ca52bdf",
      "category": "test-string"
    },
    {
      "path": "evals/triggers.train.json",
      "line": 70,
      "sha256": "b806f5c71b66510fe0ec2bfc0c21972d5c9ddcda2a19e10048897cd3c450e5ac",
      "category": "test-string"
    },
    {
      "path": "evals/triggers.train.json",
      "line": 77,
      "sha256": "7ae9ca38420982ba9e62a50a349d538642d5d0ffb159698372de139b944846fe",
      "category": "test-string"
    },
    {
      "path": "evals/triggers.train.json",
      "line": 84,
      "sha256": "5121254f4aa58301ce65cea7a14d420775eb4c034728775e3f9512ffb570c385",
      "category": "test-string"
    },
    {
      "path": "evals/triggers.train.json",
      "line": 91,
      "sha256": "12b9d91072529faeb16ede5fa002a03f82e60524ad8e400992574e9317ea40ee",
      "category": "test-string"
    },
    {
      "path": "evals/triggers.train.json",
      "line": 98,
      "sha256": "d54dd83488f554da590279084e952e8d5c2bb34d9e2b294b07c7ee358b9bbdaf",
      "category": "test-string"
    },
    {
      "path": "evals/triggers.train.json",
      "line": 105,
      "sha256": "ee9c09a4bd03a5d29283b6f959a44eaf9bdd5110e371141b5325ac4d0c835015",
      "category": "test-string"
    },
    {
      "path": "evals/triggers.train.json",
      "line": 112,
      "sha256": "a9a5e985babd7517e7b776f6a5d0f911010b7b0d90e071e3546519b1823b6023",
      "category": "test-string"
    },
    {
      "path": "evals/triggers.train.json",
      "line": 119,
      "sha256": "8c63c13a750cff8fe1982951d4a10c9b90cd944def6bc013337eef5dd21dfef6",
      "category": "test-string"
    },
    {
      "path": "evals/triggers.train.json",
      "line": 126,
      "sha256": "fdc0f09fc9cde871245bd7c0d3f3c10ea3aed37f6d02ea0b31a99d2b571e4d90",
      "category": "test-string"
    },
    {
      "path": "evals/triggers.train.json",
      "line": 133,
      "sha256": "b4dcd2c89da871df05b265481bfa39dce6b7e8e891a9a584ededfa1314b6b1c5",
      "category": "test-string"
    },
    {
      "path": "evals/triggers.train.json",
      "line": 140,
      "sha256": "89009bf612d268753c5957272e1bba1e1320208192e332405ac9208815acd17a",
      "category": "test-string"
    },
    {
      "path": "evals/triggers.validation.json",
      "line": 7,
      "sha256": "90a07f8b32e11fcf36e3240c526f933124a2e0fc6a68837aa12575246a692892",
      "category": "test-string"
    },
    {
      "path": "evals/triggers.validation.json",
      "line": 14,
      "sha256": "cfc8c50f275de414ec1357769de1fb3b117e8f385a357a60c5f7b56c54e3a03c",
      "category": "test-string"
    },
    {
      "path": "evals/triggers.validation.json",
      "line": 21,
      "sha256": "8b0e65dc7be3defa56d8b11ab8bd3382282a97a96e3d196dccedabafd094beae",
      "category": "test-string"
    },
    {
      "path": "evals/triggers.validation.json",
      "line": 28,
      "sha256": "e18b086ce0bc9aaa2412c307c82cf0eb7e79b61d86c59accbcfbd073775ffb09",
      "category": "test-string"
    },
    {